" Mr. Palmer is a 62 year old male who presented at the clinic today with a chief complaint of shortness of breath and fatigue. His vitals show a blood pressure of 80 over 50, a heart rate of 90, SpO2 of 86, pulse of 90, and temperature of 98.6. Mr. Palmer stated that these symptoms have been going on for the past six months and have worsened progressively. He visited his primary care physician a few days ago and symptoms have exponentially worsened since. He states he is unable to perform any physical activities as he experiences extreme shortness of breath but is okay at rest. He says he cannot breathe when laying down to sleep and therefore has to sleep upright. Patient denies any pain and no medications were taken to help with the symptoms. Patient has not experienced anything like this before and rates his discomfort at a 10 out of 10. Review of symptoms showed fatigue, weight gain, wheezing, orthopnea, dyspnea, and lower extremity edema. Mr. Palmer's other medical conditions include hypertension, hyperlipidemia, diabetes, and atrial fibrillation for which he takes metoprolol, 50 mg once a day, lisinopril, 10 mg once a day, atorvastatin, 10 mg once a day, metformin, 500 mg twice a day, furosemide, 20 mg twice a day, clopidogrel, 75 mg once a day, and warfarin, 2.5 mg twice a day. He has a history of a tertiary bypass performed 12 years ago and five stents placed, one of which was a left anterior descending stent placed in June of 2022. Patient has no pertinent symptoms. He is unable to perform any physical activities. Patient's social history includes a balanced diet with moderate caffeine intake, no alcohol or illicit drug consumption. Patient not only smokes one pack per day for the past 30 years and appropriate counseling was provided. Patient is married and has a stable occupation. Pertinent physical exam findings include positive jugular venous distension with no bruise, heart auscultation revealed, detect cardio with a split S2, and no murmurs. Palpation revealed a laterally displaced patient. Laterally displaced PMI and no chest wall tenderness. Lung loss quotations revealed by basal reveals and wheezing with plus one pitting edema noted with full pulses and negative Hellman sign or calf tenderness. OMIM examination revealed no TAR changes or tenderness upon palpation of Chapman's points. Labs include elevated troponin at 0.4 and elevated BNP at 4,000. X-rays show cardiomegaly and pulmonary edema. Echo revealed dilated chambers with an ejection fraction of less than 30%. An EKG is shown to be a positive. The patient is not in a state of shock. The patient is on the verge of terminal paralysis. The patient's EKG is revealed normal sinus rhythm meeting left ventricle hypertrophy voltage criteria and left bundle branch block. A likely diagnosis in this case is ischemic dilated cardiomyopathy. Mr. Palmer was counseled on his smoking habits and advised that this may worsen the problem. The patient was also advised that this condition is likely due to his past cardiac medical history. The patient was admitted to telemetry and has a NYHA-based surgery. In the experience of the patient, the patient was admitted to telemetry and has a NYHA-based surgery. Four, classification. All current medications will be withheld except quopitogrel and warfarin, endobutamine, and an insulin signing scale will be started. Patient was put on BiPAP to assist with oxygenation. A PT, INR, and serial troponin will be reordered and monitored. Patient is on strict bed rest with IO, daily weights, monitoring, DVT prophylaxis, low sodium diet, and KVO. Vitals will be checked, Q2H. Interventional cardiology was consulted, and a patient will be taken for AICD and CRTD placement. Thank you."
" A 65-year-old female, Ms. Palmer, reports to the emergency department today with complaints of shortness of breath, palpitations, and fatigue. Her onset has been worsening for the past two months, but it's gotten especially bad in the past three days since visiting with her primary care physician on Friday. She was advised to go to the emergency department because of her symptoms. She's comfortable at rest, awake, alert, and oriented, and also reports multiple episodes of near syncope within the past two months. She has a past medical history of hypertension and pulmonary sarcoidosis. Her past surgical history includes a heart catheter that she said that it was normal. Her mom passed away at 40 years old, sudden death, and her father passed away at 59 years old for myocardial infarction. She has a well-balanced diet. She enjoys going on walks. No illicit drug use, no tobacco, no alcohol. She's currently in LSD. She's a elementary school teacher. She reports having one cup of coffee per day before work so she can get through. And she's been married for the past 30 years, has one sexual partner. So her current medications include lisinopril and prednisone for the sarcoidosis and lisinopril for the hypertension. She has no known drug allergies. She reported fatigue. So the only pertinent positives for her review of systems were fatigue, palpitations, wheezing. and lower extremity swelling, especially around her ankles. Her physical findings were positive for JVD, negative for bruise, positive for palpitations. And there was a murmur present, an early systolic murmur. She reported wheezing and by basilar rails on auscultation. She... Lower extremity edema was found on physical exam as well. Of her labs, all were negative besides her BNP, which was elevated to 4,000. And her chest x-ray showed pulmonary edema, mediastinal fullness, and a normal cardiac silhouette. Her echo showed restrictive cardiomyopathy with increased wall thickness and an ejection fraction of 55%. Her EKG showed normal sinus rhythm with non-sustained left ventricular tachycardia. Her joyoblast is safe by no means What I saw afterwards after talking to the patient. Naeer Cult assays, association class two, because she did not report having difficulty with activities besides exercise. And and, and so this is secondary to her hypertension and her pulmonary sarcoidosis. So the patient was admitted to telemetry with a diagnosis of sarcoidosis qualified of coronavirus. And this is sorted under her sy办法根据很重要的通关in states  jiáng dù companies h diàn de mixi birxa içeostimuggléat música làm Her pulmonary special- bullype procedure is love better than Labouria. government immediately express both are special Ella looks really satisfied. diagnosis of sarcoidosis, restrictive cardiomyopathy secondary to sarcoidosis. It's a serious condition. She will be getting vitals due two hours and out of bed with assistance. And nursing instructions include strict ins and outs, daily weight, DVT prophylaxis, and O2 via nasal cannula to make sure that it's at least 96%. I recommended a low-sodium diet so that we can get some of the fluid off. We included keeping the vein open for fluids. We will continue the lisinopril, but we will also add on furosemide, 40 milligrams IV, and increase her prednisone to 60 milligrams. And we'll be administering amiodarone, 150 milligrams via IV, because of the ventricular tachycardia. And we will also be ordering a CMP panel for labs, and so we can further monitor the sarcoidosis. And we'll be consulting interventional cardiology for defibrillator AICD placement, and we'll be consulting radiology to get a PET scan to further show the sarcoidosis."
" This is Palmer, who is a 62-year-old female with a history of pulmonary sarcoid and hypertension. She comes to the ED today with episodes of shortness of breath, near syncope, as well as fatigue and palpitations and orthopnea. She says that this has been going on for about two months and worsening since onset. She saw her primary care physician for her symptoms about three days ago and had some tests done. She's unsure of what tests were done, and she hasn't gotten those results back yet. She called them today due to exacerbation of her symptoms and was referred to the ER. She says that her symptoms are exacerbated with most of her activity. She notes that she... Was previously very active, walking about five times a week, but now is unable to do that due to her symptoms. She also notes orthopnea, noting that she is now sleeping in the recliner due to shortness of breath when lying flat. She denies any loss of consciousness. She denies chest pain. She does endorse an eight-pound weight gain in the past two weeks, as well as some... Lower extremity swelling. She also endorses some subjective wheezing. Her history, as I said, she has pulmonary sarcoidosis, which she is on chronic prednisone, 10 milligrams. She also has hypertension, for which she's on lisinopril, 10 milligrams a day. She had a clean cardiac cath about a year ago after an abnormal EKG or PCP. She denies... She has tobacco use, alcohol, illicit drug use. She lives at home with her husband, who she says is supportive. She does have insurance for her job as a fourth grade teacher. Vitals were significant for slight tachycardia at 110, with slight hypertension at 136 over 99. Her SpO2 was slightly hypoxic at 91%. She was eight feb. brow. She had a lot of symptoms, and she was in a very good state. Physical exam was significant for a systolic murmur with an S4 gallop. She did have positive JVD, but no carotid bruise. She had bipasular rows and wheeze in her lungs, in both lungs. She did have one plus pedal edema with no capitularness and negative Hohmann's sign. Labs were remarkable for a... an elevated troponin of 4,000, or... or elevated BMP of 4,000, I'm sorry, and a negative troponin. Chest X-ray showed mediastinal fullness consistent with pulmonary sarcoid. She had no cardiomegaly and no pulmonary edema. EKG did show a sinus tachycardia at a rate of about 100. She had a normal access. She did have a run of non-sustained V-tach on the EKG. But her rhythm in the room was a normal sinus. ECHO did show restrictive cardiomyopathy with increased wall thickness. EF was normal at 55%. I believe that her symptoms are due to sarcoidosis restrictive cardiomyopathy with an NYHA scale of 3. For her, I would like to admit her to telemetry. And... give her imiodarone for the non-sustained V-tach. Keep her on her lisinopril and increase her prednisone dose to 60 milligrams a day PO. I also would like to give 40 milligrams of furosemide IV for her fluid overload. As far as labs, I would like to order a... CMP to keep an eye on her potassium because we're giving that furosemide. I don't believe she needs any diagnostic imaging orders at this time. But I do want to consult radiology for a possible FDG PET scan to look at the infiltrates in her heart. I would also like to consult interventional cardiology for a possible AICD placement, given the NSP. EL BR發 cared by While In outsiders Thank you very much! I remind you that, if you are good at communicating, you may urgently request your partner in the群 now. Police is seriously at your service. Please go ahead and communicate. Sorry. Thank stop."
" Mr. Leslie presented to the clinic today. He's a 62-year-old male. I'm going to restart. 62-year-old male, Mr. Leslie presented to the clinic today, three days after something concerning came up from his family medicine doctor. He has a fairly extensive past medical history, hypertension, hyperlipidemia. He is a type 1 diabetic and smoked a pack a day for 30 years. But he, more concerning right now is his elevated blood work, his troponins, he has severe orthopnea and very, very extensive undue dyspnea on exertion. So even having dyspnea at rest, but he has a history of AFib. He's had an open heart surgery. He's had a CABG, he's had a CABG artery bypass graft. He's had a cardiac stent for the past, one a year for the last five years. His parents didn't necessarily have any sort of similar issues. He was, like I mentioned, he was a, he is a smoker. For his stance, he's on blood, he's on clopidogrel, metoprolol, he's on furosemide, lisinopril, warfarin, metformin. He doesn't have any allergies. He has, he's had eight pounds of edema in his lower extremities that he noted. He's had a lot of edema in his lower extremities that he noted. During the review of systems, there's very few pertinent negatives on our thing, except he has not experienced any chest pain or discomfort. No palpitations, though he says he has some sort of on and off AFib, paroxysmal AFib, atrial fibrillation. And walking in, notice his blood pressure to be 80 over 50, heart rate of 90, respiratory, respire is a little bit elevated, a bit, a bit, a little bit, a little bit, a little bit, a little bit, a little bit, a little bit, a bit, a little bit, a little bit, a little bit, a little bit, a little bit, a little bit, a little bit. And very low of two SATs, SPO2 around 86%. Did have jugular venous extension on physical exam. No murmur, friction rub, gallop. His PMI was displaced bilaterally and then sure enough, he had a cardiomegaly on, on chest x-ray. Rail, sure enough, were present. Did in fact have pedal edema. Normal pulses and extremities. He does have an ejection fraction of less than 30% on, on 2D echo, P-lax view. BMP was elevated, troponin was elevated. Also classified here as a New York Heart Association, New York Heart Association class four heart failure. Likely now going the direction of adding dibutamine on top of the, the not working. Intervascular, very dry, nearly as a potato chip. And he, he cannot take any more diuretics. So we're going to add dibutamine. So I'd like to add dibutamine. Definitely going to admit him to the ICU as a critical patient. Monitor him every two hours. Strict eyes and nose, DVD prophylaxis. Have him take good care of him. Do a KVO. No standing fluids because he's in pretty bad severe heart failure. Isn't having any pain, but I'll keep a, I'll keep him in the ICU. So I'm going to add dibutamine. I would like to keep a thinner going, a thinner going. Do not, not adding any sort of diuretics. I put them on an insulin sliding scale instead of his metformin. Of course, monitoring PTINR. And then I'm going to have interventional cardiology, take a look at him, though. They had, they said no more stinting or cabbage bypasses, but, but it is likely that I would recommend maybe a, because of a left bundle branch block and a left axis on the axis on EKG, I recommend a cardio resynchronization therapy device, as well. As an automated internal cardiac defibrillator. If, if noted, if deemed so by the interventional cardiologist. That is all I have. We will keep an eye on him, watch him very closely. We'll send him up to the ICU now, if that is okay. All right. Studio detective Tate, out. ."
" She's a 62 year old female who presented to the emergency department due to extreme fatigue and shortness of breath. She did include that about two weeks ago she was sick with a fever, cough, runny nose, and she thought she just had a cold. She was able to continue to exercise through this time, but it was just causing some fatigue and shortness of breath. She said about five days ago her symptoms resolved and she thought she was getting better. But then she went to her primary care doctor three days ago because she was still having really bad fatigue when she was trying to do activities. The fatigue and shortness of breath does not occur at rest. I took a history of the patient. She does have a medical history of hypertension and surgical wise. She had a cardiac catheter done, but she said there were no significant findings with that. She does take one medication, which is lisinopril 10 milligrams. As far as family history, her mom passed away from breast cancer. About five years ago. And her dad is currently in a home. He has Alzheimer's or dementia, but he's still living. As far as her social history, she does not use any alcohol, tobacco, or illicit drugs. She works as an elementary school teacher. She said her diet is good and balanced. Her caffeine use is moderate. She says about a cup a day. As far as exercise, she does remain active. She likes to go to the gym about three times a week, but has been unable to since her cardiac symptoms, shortness of breath, and fatigue started. She has been on a diet for about a year. And as far as living situation, she is married and stated she feels supported and comfortable at home. She has no known drug allergies. As far as her ROS, she did have fatigue and a recent weight gain. She stated of about eight pounds. There were no skin issues, no headache or neck stiffness. She did feel chest palpitations, and she was also positive for wheezing, dyspnea, and orthopnea, meaning she was more out of breath while she was laying down. She also did notice some lower extremity edema. As far as her appearance, she was awake and oriented. She was just extremely fatigued. Her vital signs, her temperature was 98.6, so no fever. Blood pressure was 130 over 90. Oxygen was 91. Heart rate 110. And respiratory rate was 20. For physical exam, I didn't hear no carotid brewery was present, but she did have JVD. As far as her heart, she had a regular rate. No murmur, friction rub, or gallop were heard, but her PMI was displaced laterally. Wheezes and rails were also present, but she had no chest wall tenderness. She had no calf tenderness. Her lower extremity pulses were full and equal, and she did have plus one pitting edema. As far as her chest x-ray, this indicated cardiomegaly as well as pulmonary edema, which I explained to the patient. And her echo was indicative of a dilated cardiomyopathy with a left ventricular ejection fraction less than 30%. Her EKG came back as sinus tachycardia with a right bundle. In her labs, her troponin was elevated, and her BNP level was 4,000. Now, knowing all of this, plus her history and her diagnostics, I did make the diagnosis of myocarditis dilated cardiomyopathy. She was at a NYHA classification of 2 because she was still able to do some activity, and her symptoms did get better at rest. But they also were triggered when she was exercising. Therefore, I told the patient that we did. I told her that she was going to be able to do some activity, but she was not able to do it. So I told her that she was going to be able to do some activity, but she was not able to do it. Her condition was serious. She's going to be getting vitals every two hours. Activity is as tolerated. As far as nursing interventions, she needs strict INOs, daily weights, DVT prophylaxis, maintaining her O2 stat above 96%. And she's also going to get an O2 nasal cannula. Diet-wise, she should be low sodium. IV fluid should be KVO, so just keeping that vein open. And then as far as medications, I instructed the patient. We were going to do a lot of work on her. We're going to be giving her a pain med. So that's acetaminophen, 625 milligrams by mouth. She can stay on her lisinopril, which is 10 milligrams by mouth daily. That's what she's already taking, and she will continue to. And then we're also adding furosemide, 40 milligrams by IV. She needs no type of diabetic intervention, no BiPAP. And for labs, I'm ordering serotroponins as well as a CMP. And she's going to be met by an interventional cardiologist, infectious disease, and radiologist. And they are going to consult about an AICD. And then we're going to be doing a CRTD placement, a CRTD placement, doing a media-enhanced MRI, as well as an endomyocardial biopsy. The patient was instructed of all of this, that she would be admitted, doing additional labs and testing, that we were going to keep her on some medicine, as well as add a painkiller and a medicine that was going to improve her cardiac function. And the patient was agreeable to the plan. She stated she has a good support system at home, as well as insurance, and she was comfortable moving forward with this. Thank you. Thank you."
" All right. So the patient today was a 62 year old female named Leslie. She presented to the office with complaints of dyspnea and with dyspnea and fatigue. She stated that she was sick with a viral illness two weeks ago with fever, cough, chills, all of that sort of stuff. She started feeling better, but then she started having the shortness of breath symptoms and exercise intolerance. She said that she has trouble breathing when she's laying down and she's had to sleep in her recliner because she can't breathe. So she also has orthopnea. She would be considered an NYHA class two because she has slight restriction in her activity. She described her diet. She said that she has a diet as balanced. She denied illicit drug use, tobacco use, alcohol use, one cup a day of coffee. She was working out two times a week at the gym, but then she had to stop due to her symptoms. She's an elementary school teacher and she teaches the third grade and she's married. She has a past medical history of hypertension for which she's taking 10 milligrams of lisinopril daily. She has no known drug allergies. She had a cardiac catheterization about a year ago and the results of that were normal. Her mother passed away from breast cancer and her dad is 89 with dementia and he's in a nursing home right now. She talks about how she's gained eight pounds. She was having trouble breathing. She's wheezing. She felt like she was having heart palpitations. She's been on medication for a long time. She's been on medication for a long time. She has some symptoms as well as chest pain. Her vital signs. Her temp was good. Blood pressure was a bit high at 130 over 90. Her O2 sat was a bit low at 91 and her heart rate was a bit high at 110. Her chest X-ray showed cardiomegaly as well as a pulmonary infiltrate with pulmonary edema. Her troponin levels were raised at 0.1. And BMP levels were raised by 0.3. and P levels were raised at 4,000. Her EKG showed tachycardia, a left axis deviation, and a right bundle branch block. Her echocardiogram showed dilated cardiomyopathy with reduced ejection fraction. All of this led me to believe that she had myocarditis due to that viral infection with dilated cardiomyopathy with reduced ejection fraction. And I told her that we needed to admit her to telemetry, that we were going to add 625 grams of acetaminophen for pain control, as well as 40 milligrams of furosemide to get rid of some of the fluid. I'd like to repeat the troponins and also repeat the CMP since we started that furosemide. I'd like to consult with a radiologist to get a contrast MRI to see where the implant was. And I'd like to consult with a radiologist to get a contrast MRI to see where the implant was. And I'd like to consult with a radiologist to get a contrast MRI to see where the inflammation is in her heart. I'd also like to consult intermediate interventional cardiology to talk about placing a CRTD or an AICD. I'd also like to get a repeat on the 2D echo. And then I'd also like to consult infectious disease to see if we can figure out the cause of the virus that causes myocarditis. That is all. Thank you."
" Hello, today we have 62-year-old Ms. Palmer presenting to the ER with chief complaint of shortness of breath and fatigue. She said she had flu-like symptoms two weeks ago, which included cough, runny nose, as well as a fever. These symptoms cleared up and then were followed by shortness of breath, fatigue, and a chest ache five days ago. She went to her PCP the same day, who told her to wait and see how the symptoms progressed. Today the symptoms became worse, so she came here to the ER. The patient reports that some exercise makes her chest ache worse, putting her in line with a New York Heart Association class of two. In contrast, sitting up makes the shortness of breath better, which is why the patient has been sleeping in a chair at night. She rates the pain as a 2 out of 10 and describes it as being dull in her chest and says that there is no radiation of the chest pain. The patient underwent a cardiac cath. She was diagnosed with a heart attack one year ago after she had an abnormal EKG, which found nothing out of the ordinary. She has a history of hypertension, for which she takes the Cinepro. Her positive review of symptoms include fatigue, 8-pound weight gain over the last two weeks, achy and swollen lower legs, chest pain and palpitations, as well as some orthopnea. Her vitals are as follows. 130 over 90 blood pressure. 110. Heart rate. 20 respiration rates. 98.6 temperature. And 91.02 on room air. Physical exam was positive for JVD bilaterally, wheezing and rails bilaterally on auscultation, fetal edema, as well as a laterally displaced PMI. Her lab showed increased BMP and troponin. The chest x-ray indicated cardiomegaly as well as pulmonary edema. Her echo showed dilated cardiomyopathy with an ejection fraction less than 30%. EKG was normal sinus rhythm. Based on the symptoms and workup, I believe she has myocarditis dilated cardiomyopathy. I suggest we admit her to telemetry, continue her lisinopril while adding acetaminophen and Lasix, and have interventional cardiology, infectious diseases, and radiology follow up on her. Additionally, I would like to administer IV fluids, a diet low in sodium, daily weight checks, DBT prophylaxis, oxygen by nasal cannula, maintaining oxygen sats over 96%, and activity as tolerated. We will perform serial troponins and the CMP as well as a repeat 2D echo to aid in care. Thank you."
