" Mrs. Palmer is a 62-year-old female presenting to the ER with chest palpitations and syncope. The symptoms have been gradually getting worse over the past two months and have increased dramatically over the past three days. They happen during any activity. The patient presented with an eight-pound weight gain, swollen legs, syncope, palpitations, coughing, and is currently sleeping in a chair. Her previous medical problems are hypertension, controlled, and pulmonary sarcoidosis. Her current medications are prednisone and lisinopril with no known drug allergies. She does not use tobacco, illicit drugs, or alcohol. She walks on a daily basis, drinks one cup of coffee per day, and is an elementary school teacher. Her mother died from sudden death at age 40 and father from a myocardial infarction at 59. Her physical exam showed jugular venous distension, wheezing, and S4 murmur, lower extremity edema. Labs and imaging support the diagnosis of sarcoidosis that has infiltrated the heart muscle. Our plan is to admit to the hospital where she will follow up with a cardiologist and radiologist for a PET scan. We will up her dose of prednisone to 60 milligrams, add furosemide, and amiodarone. She will continue on her current lisinopril. Thank you."
" Hi, Dr. Rollins. I just saw Ms. Palmer in room six. She's a 62-year-old female who presents to the emergency department with a two-month history of worsening dyspnea, fatigue, palpitations, and near syncope. She stated that her symptoms improved with rest. However, they were brought on by most activity, including her daily tasks. She denies any chest pain, but also reported that some orthopnea causing her to sleep in her chair at night. She stated that she was seen in her family practice office three days ago where they did a 2D echo, EKG labs, and a chest x-ray. She stated that she was instructed by her family practitioner to come to the ER due to her worsening symptoms. Her active medical conditions include hypertension, for which she takes lisinopril 10 milligrams, and pulmonary sarcoidosis, for which she takes prednisone 10 milligrams once daily. She reported that both medical conditions have been well controlled with her medications. She denied any allergies and reported that she had a cardiac cath about a year ago due to an abnormal EKG, but there was no coronary occlusion. She denied any prior hospitalizations and reported that she is fully immunized. She reports that her mom died suddenly at the age of 40, and her father died of a myocardial infection at age 59. She stated she has a great deal of information about her health, but she has no information about her health. She stated she has a good support system and lives at home with her spouse. She stated that she is sexually active with her spouse and that the relationship is monogamous. She stated she has a balanced diet and used to walk daily with friends until her recent symptoms have prevented her from continuing to do so. She denies any tobacco use, alcohol use, or illicit drug use, and reported that she drinks about one cup of coffee in the morning and works as a third grade school teacher. Sheиру Van Rondon, consumer growth average 않t clocksates from 14-18 year old with weekend reflux and HIV to palpation. I also evaluated anterior Chapman's points, posterior tart changes, and her thoracic spine, and I had no osteopathic findings to report. Her chest x-ray demonstrated mediastinal fullness with diffused pulmonary infiltrates and a normal heart size. Her echo showed a restrictive cardiomyopathy with an ejection fraction of 55%. Her EKG revealed a normal sinus rhythm with non-sustained ventricular tachycardia, and her labs revealed a normal troponin but an elevated BNP at 4,000. Based on my findings, I believe she has sarcoidosis cardiomyopathy, NYHA class 3, and I explained that I believe the pulmonary sarcoidosis has begun to infiltrate her heart as well. I recommended that we admit her to the telemetry unit and consider consult with interventional cardiology for the placement of an AICD and consult with radiologists. I also recommended that we keep her on the lisinopril, increase her prednisone dose to 60 mg daily, add furosemide 40 mg IV, and also an amiodarone drip of 150 mg. And that is all. Thank you."
" She is 62 years old and presented to the emergency room. She said rest makes her pain or her shortness of breath better and also sitting up in her chair and exercise makes it significantly worse. So, Ms. Palmer is a female and her past medical history consists of diabetes, hypertension, as well as hyperlipidemia. She's been experiencing these symptoms for about six months. And went to her PCP about three days ago. They sent her to us. Now here she is. So, her medical history also includes diabetes. I'm not sure if I mentioned that. And I have my notes in front of me. The patient has a history of a... Bypass surgery. And got about five stents beginning place. The first one was placed 20 years ago. The most recent one was placed a year ago. And she was told she can no longer receive that sort of treatment. Excuse me. She appeared well. Alert. However, slightly fatigued. And she didn't have any skin lacerations and bruising. Just fatigue, shortness of breath, or chief complaints. She had no neurological signs. Her heart was beating fast, she said. So, syncope. And dyspnea and... Better with lying down. So, orthotimia. And... She had wheezing and rails. When she came in. So, the physical exam showed that she had jugular venous distension. As well as the wheezing and the rails. She also had pedal edema. And... Even pulses. She... Said her mother had breast cancer and her father had Alzheimer's. She... Is on a handful of medications. She's on amiodarone, warfarin, clopidogrel, metoprolol, metoprolol succinate. And... I had the history of the surgical procedures of the Shonda. She has no allergies. And... After all the diagnosis done, or all the... Um... Um... Um... A physical exam was done. Uh, we... Talked about our results together. Um, I presented her EKG, which showed a left bundle branch block, some left ventricular hypertrophy, but normal sinus rhythm. Her, uh, echocardiogram showed dilated cardiomyopathy. And her x-ray showed cardiomegaly with pulmonary edema. As well as her labs. It showed elevated troponin of 0.4 and her BNP of 4,000. Um... After that, I had a heart attack. Um... After this, I... Um... Originally had the differential of potential... Um... Heart failure. Um... Maybe some musculoskeletal chest pain because she wasn't in the best health to begin with. And, um, ischemic cardiomyopathy... Ischemic dilated cardiomyopathy. And that is what it ended up being. Um... So... She... Was advised... Um... To be admitted to the ICU. And... Talked to an interventional cardiologist who would get her set up with an AICD and a... And... Um... Not place another stent, but place another cardiac device. Um... And... Um... And... Um... She was admitted to the ICU. So, she was being admitted on a low-sodium diet with, um, absolutely... Uh, the total restriction to exercise. Um, her nursing orders were strict IO, um, daily weights taken, and DVT peripheral access. Um... Yeah, moving ahead, she will see all the specialists, be in the hospital until... Um... She will be admitted to the ICU. Um... And... Um... She will be admitted to the ICU. Um... And... You will see all the specialists. Be in the hospital until she's feeling better. Um... And we did shift her medications, so she's only taking clopidogrel and warfarin and doputamine now. Um... And... She was put on an insulin sliding scale, and she was admitted because of her diabetes, as well as, uh, given a BiPAP machine to help with her shortness of breath. And the patient also had a history of atrial fibrillation. Um... When the patient was asked if they had medical insurance and they did, they have a pharmacy set up and they have support at home. They are in a good place moving forward and I'm hopeful that they will be able to receive the care that they need and continue on their journey to find help."
" Mr. Leslie Palmer, who is a 62-year-old male, presents with two weeks of fatigue, shortness of breath, and palpitations. Patient also reports instances of feeling like he would pass out. He states that he is not short of breath at rest, but that even with walking short distances, he is short of breath. I think I would give him an NYHA score of class three. He is able to lay flat and denies any recent illness. He has a history of hypertension and is on lisinopril. His family history includes history of sudden death in his mother and an myocardial infarction in his father. He reports a year ago that he had a cardiac catheterization and that was normal. He does not smoke, drink alcohol, or do illicit drugs. He is a school teacher. Review of systems were positive for fatigue, warmth of the touched skin, palpitations, near syncope, wheezing, and shortness of breath. No chest pain or ortho... orthopnea. Vitals were remarkable for hypotension at 80 over 50 and hypoxia at 85% on Romare. Physical exam showed systolic murmur with S4 gallop. He had a PMI point of maximal impulse that was displaced laterally. Lungs were clear to association. There was no calf tenderness, no lower extremity edema. PT and DP pulses were full and equal bilaterally. Lab showed a troponin and BNP within normal limits. NKG showed left ventricular hypertrophy and telseptal R waves. Echo showed thickened interventricular septum with an EF of 60%. Patients should be admitted to telemetry due to diagnosis of hypertrophic cardiomyopathy. Secondary diagnosis would be hypertension. I advise the patient that we should discontinue lisinopril and start on diso pyrimidine. Consult was done with interventional cardiology for AICD placement and cardiothoracic surgeon for either alcohol ablation or myomectomy. Patient is in agreement with plan. He was canceled on the further plan and he was alerted of the cause of his symptoms. Thank you."
" Good morning. Ms. Palmer is a 62-year-old female presenting to us with shortness of breath. Patient states that they're physically active and exercise routinely, but started developing difficulty breathing when exercising. This encounter occurred prior to our visit several weeks ago and has had a gradual onset. Patient states that they feel short of breath when exercising and describes it as it's isolated only to the chest. It is aggravated when exercising and will leave by stopping physical activity. Patient has a prior history of cardiac catheterization and currently presents to us with a previous history of hypertension. Patient states do not have any known allergies. Patient follows a balanced diet, does not consume alcohol, tobacco, or any illicit drugs. The patient drinks coffee in the mornings and family history. The patient's mother passed away suddenly without reason and the father passed away from a myocardial infarction at the age of 59. Ms. Palmer is fatigued, reports presyncope, palpitations, and wheezing. She is currently on Lisanopril 10 mg once per day. The patient was alert and oriented. Physical exam found jugular venous distension, regular heart rate, wheezing, and rails. Upon physical exam, calfless non-tender presents lower extremity edema. Imaging found cardiomegaly and via 2D echo demonstrates left ventricle asymmetry and hypertrophy with ejection fracture of 60%. EKG presents tall R-wave and septal leads. Troponin and BNPR are within normal limits. Completion of physical exam and interview led to a suspected diagnosis of familial hypertrophic. Cardiomyopathy. Patient is classified New York Heart Association 2. Is to be sent to the telemetry unit under serious condition. Every two hours of activity is tolerated. Nursing intervention consists of strict INOs, O2 via cannula, and to maintain at 96%. Patients should be on DVT prophylaxis and patient can receive a regular diet. IV orders are KVO. We discussed the plan and is to discontinue. Discontinue Lisanopril and hold it and administer disoperamide. 100 milligrams PO. No labs and images are needed. We plan to consult cardiology for AICD placement, but we did not get to discuss cardiac surgery, but should be consulted for septomyectomy. Patient was briefed and asked if she had any questions for her care and agreed upon the treatment plan. Thank you so much. Thank you."
" I am reviewing today is a 65-year-old male named Leslie Palmer. He presented with shortness of breath and fatigue when exercising. He mentioned he had several episodes of near syncope. He went to his family medicine doctor where they ran multiple tests and he was recommended to come to the ER if he kept having these symptoms. He again had shortness of breath, near syncope. He was breathless and fatigued when he tried to exercise and his heart was beating out of his chest. When going over his past medical history, he had hypertension, which he was on 10 milligrams of lisinopril for. He had a cardiac cath a year ago due to an abnormal EKG. When discussing his family history, he mentioned his mother died suddenly. At 40 years old and his father was deceased at 59 from a myocardial infarction. When discussing his social history, he denied use of tobacco, alcohol, and illicit drugs. He had a balanced diet with fruits and vegetables, protein. He went for regular walks before his shortness of breath and he was an elementary school teacher and had a spouse of over 30 years. He had no known drug allergies and when reviewing the systems, he appeared fatigued and complained of fatigue. He had no fever or chills, no weight changes, either loss or gain, no rashes, no bruises, no lesions on the skin. Heant findings were negative, so no headache, no stiffness of the neck, no visual or auditory difficulties. For cardiovascular, he did have those palpitations and your syncope, but no chest pain. He complained of wheezing and dyspnea, but orthopnea was okay. When discussing MSK, he had no muscle pain or joint pain and no edema in his lower extremity. He had no dizziness or confusion or gait changes. When reviewing the labs, his troponin and BMP were less significant than his regular clues of any component of his body and that gave him signs on his upper arm, joints, or his body type, including some blushes, sneezing, and drooling. Along withец Ty arguing that I am tired of profuseけど dang, I had no weight gain, made demonstration shots that제 did not feel like it was worth it on since I was 7 years old and sicknessLA appeared to beemorally significant for his body and that Mr. Ch proteins also indicated that it helps avoid the development of joint pain. His metabolism was also greatly reduced by Ü40,Wl,LL, Psalm study loss and inflammatics. When looking at the patient's thronged waist by mean, his chest ma However, his chest may be requiring emergency Sole시고 tests because the artemisital tissue has to run continuously Jenath adjusted 올라x andopard , and spleen, and pulmonary sunglé. his pulse, 130 over 90 for his blood pressure, 96 oxygen and respirations were around 16. After reviewing everything, we came to the conclusion that this was familio hocum, so hypertrophic myocardial hocum. And when we looked at everything, we recommended seeing a cardiologist and a cardiothoracic surgeon for septal ablation or some other sort of surgery to treat the septum, including the AICD placement from the cardiologist. This was the conclusion of this patient."
" Today I saw Dr. or Mr. Leslie Palmer. He's a 62 year old male. He came in complaining of shortness of breath and fatigue. Uh, it has been progressing throughout the last six months with the last three days getting gradually worse, uh, and very severe today. He came to the emergency department at the recommendation of his primary care physician who suggested that he come. Um, he is having dyspnea even at rest and has to sleep upright. So orthopnea as well, uh, past medical history pertinent for atrial fibrillation, hypertension, dyslipidemia, and diabetes diabetes for the last 15 years, atrial fib for the past five, his surgical history is positive for a coronary artery bypass graft and five cardiac stents. He has maxed out on stents and the cardiologist indicated no further intervention family history for maternal. His mom has breast cancer and his dad paternal has, uh, Alzheimer's, but he is still alive. As far as social history, it is positive for tobacco use. He is a smoker for the past 30 years. Um, no alcohol, no drugs. He is employed and has a regular balanced diet and he used to exercise, but is now unable to due to the shortness of breath and fatigue. And he lives with his spouse, his wife, current medications, atorvastatin 10 milligrams, clopidogrel 75 milligrams once a day without atorvastatin was once a day. Ferozomide 20 milligrams twice a day, metaprolol sexinate 50 milligrams once a day, lysinopril 10 milligrams once a day, metformin 500 twice a day and warfarin 2.5 milligram twice a day. He is compliant in all those medications, no known drug allergies. His review, his review of symptoms is positive for fatigue, weight gain, um, shortness of breath. So the dyspnea, the orthopnea, he also has positive wheezing and lower extremity edema. He is awake and alert and oriented times four, but he is fatigued. Uh, vitals today, temperature 98.6, normal heart rate, 90, normal, uh, respiratory rate 22. So a bit of tachypnea rest or blood pressure, 80 over 50. So very low blood pressure and oxygen saturation, 86%. So low, uh, jugular venous dissension was present on physical exam, but there were no carotid breweries on auscultating his heart. I did hear a gallop, but no murmur, no friction rub. And he did have tachycardia with a PMI. Pulse of maximal impulse displaced laterally lungs, uh, were positive for rails and wheezing, but no chest wall tenderness. Um, as far as his lower extremities, I did auscultate or I did check his pulses. Those were full and equal. He did have some fetal edema, but his calves were non-tender and human site negative imaging. Um, we had a chest x-ray results with cardiomegaly pulmonary edema, 2d echo with indicated dilated cardiomegaly pulmonary edema, and a chest x-ray with ejection fraction, less than 30. His EKG showed normal sinus rhythm, but left bundle branch block and his labs troponin was elevated at 0.04 and BNP was elevated at 4,000. So I indicated that he's diagnosed with ischemic dilated cardiomyopathy. I did explain this to the patient. His New York heart association classification is four as he is unable to carry on physical activity, even at rest his disposition. We should admit him to the hospital. He's not able to carry on physical activity, even at rest. We should admit him to the ICU in serious condition, check his vitals every two hours. I think he should be on strict bed rest and the nurses should check strict ins and outs daily weight and check for DVT prophylaxis. I recommend a sodium low sodium diet. And if we indicate fluids, we should keep his vein open for now. Um, as far as medication changes, I would like to continue his warfarin and his clopidogrel, uh, change all his other ones. Um, add on disopiramide 100, which is a very good one. Um, and then I would like to recommend him to once a day and change that metformin to an insulin sliding scale. Since his oxygen saturation is so low at 86, I would like to place them on BiPAP and, uh, order the labs serial troponin and PTINR for consultation. I'd like to consult interventional cardiology so that they can check for if he is a candidate for pacemaker, either AICD or CRT. Other than that, we should get Mr. Palmer into the ICU and see if we can have him. So I would like to recommend him to a doctor. I would like to recommend him to a doctor. I would like to recommend him to a doctor. I would like to get his shortness of breath and fatigue figured out and get that oxygen saturation much higher. All right. Thank you."
" I met Mr. Leslie Palmer, who's a 62-year-old male, and presenting with episodic chest pain, sorry, episodic near syncope associated with lightheadedness, palpitations, shortness of breath, feeling raspy and wheezing for the past two weeks. He says symptoms get better with rest and describes it as severe in nature. Episodes last 30 to 45 minutes. He denies any prior history of this and says this is new in the past two weeks. His past medical history is significant for hypertension, and he's currently on 10 milligrams of lisinopril for that once a day. He has a history of a cardiac catheterization that came back normal. His family history was significant for his mother passing away at 40 from what was predisposed to be a sudden cardiac death. His father passed away at 69 from an MI. His review of systems was positive for fatigue, lightheadedness, near syncope, palpitations, wheezing, and dyspnea. He denied any fever, chills, weight changes, skin changes, any myalgias, joint pain, chest pain, orthopnea, no neck swelling, trouble swallowing, or anything of that nature. His vitals. His heart rate was elevated at 110. Otherwise, his vitals were normal. His oxygen was 96%. His respiratory rate was 16. Blood pressure, 130 over 90. And his temperature was 98.6. On exam, he had positive JVD. His cardiovascular exam was regular rate. No murmurs, rubs, or gallops noted. His PMI was... His heart rate was displaced laterally. And we noted bibasilar rails and wheezing present. He had plus one pitting lower extremity edema, but otherwise full DP, PT pulses, no calf tenderness, or Hohmann's sign. My assessment is that the patient was awake, fatigued, and oriented. And then going through his results, his chest x-ray showed cardiomegaly. Cardiomegaly. Otherwise normal. 2D echo showed left ventricular asymmetry with hypertrophy. EF of 60%. His EKG was normal sinus rhythm at 60. That was the rate. With normal axis, LVH criteria, and peak R waves in septal leads. His troponin and BNP were both normal. And with this information, I diagnosed the patient with... With... Familial hypertrophic cardiomyopathy. I gave him a class two New York Heart Association. And I gave him a secondary diagnosis of hypertension. I decided to admit him to telemetry. His condition was serious at the time of admission. I ordered vitals every two hours and activity as tolerated. For nursing orders, I added in a strict IO, a daily weight, oxygen via nasal cannula, two liters per minute to maintain that SAT of 96% or greater. In addition to DVT prophylaxis. For diet, I ordered regular diet for him. And then to keep the vein open for IV. And then as far as his medications goes, I asked him to discontinue the lisinopril and start the disopiramide at 100 milligrams PO. And for consults for this patient, I requested he be seen by interventional cardiologist. And removing some of those Resus bre unrelated to his therapy. Yes. Without saying anything. So, we'll continue to come back after this. Thank you for attending this show. We'll see you next time. Have a great day. Thank you, guys. Itcar beautiful, welcome opportunities. Thank you all for joining with me. Thank you"
