" I saw earlier in the ED, Ms. Foster, she presented with a two-month history of chest flutters and dyspnea on exertion. She states that over the last three days, it's gotten worse. She saw her doctor who had ordered some lab tests, but when she called in and said things had gotten worse the last couple of days, they recommended that she go to the ED, so she presented today. She states that she's having to be sleeping in a chair due to orthopnea at night. She has a history of pulmonary sarcoidosis. As far as her past medical history, she has a history of hypertension, which she takes lisinopril for, and she's also currently on 10 milligrams of prednisone for her sarcoidosis. Past surgical history includes cardiac cath that she sent went well. Last year, she was on a blood test, and she was on a blood test for her heart. Her family history on the other side, she said that her mother died at age 40 from sudden death. They weren't exactly sure it occurred, and her father is also deceased at age 59 from NMI. As far as her social history, she does not drink alcohol, does not use tobacco, does not use illicit drugs. She's a teacher for occupation. Diet is well-balanced. She does drink one cup of coffee a day. She states that she normally will exercise, like walking with her friends, but recently due to the inability of the shortest of breath upon exertion, she has no longer continued to walk with her friends. Living situation is stable. She has support at home. No known drug allergies. As doing her review of systems, she had some fatigue and some recent eight-pound weight gain in the last couple weeks. Her healthیh wasRA system was good. Something didn't work out, but then she did足 like probably eight pounds a day. Her heart apatiensh played a big captive part of her life from that and her neck went to the.. post Mas T Duncanvery FA eine region of scripture that she won an Amin d that she had had some dyspnea and orthopnea. She had some lower extremity edema, but otherwise no muscle aches or pains. Neuro, she had no confusion, dizziness, or gait disturbances that she had noticed. As far as I could tell, she was alert and oriented. She did have some fatigue. Vital signs were 136 over 99, heart rate of 110, and respirations of 20. SpO2 was at 91. When I further did an evaluation of the patient, she had a positive JVD, but no carotid bruit. Her heart rate was regular, but there was an S4 murmur noted, a positive gallop, and no regurge. She did have some peripheral edema, lung sounds. She had some bilateral bronchi with wheezing. After the physical exam, some x-rays and an echo along with an EKG were ordered. I interpreted at the patient's bedside those results. Her lab showed elevated BNP with normal troponin. Her EKG showed not sustained ventricular tachycardia with otherwise normal sinus rhythm. Her echocardiogram showed restriction in her cardiopathy. It showed restricted cardiopathy with normal sinus rhythm. Her ECG showed increased wall thickness, but the ejection fraction was still 55%. Upon reading her chart, examining the patient, and looking over her lab results and x-rays, I determined the patient most likely was having cardiomyopathy related to her sarcoidosis. I advised that the patient be admitted to telemetry, vitals every couple of hours. She can be admitted to a hospital every couple of hours. She can be admitted to a hospital every couple of hours. I advised that the patient be admitted to a hospital every couple of hours. She can be admitted to a hospital every couple of hours. I also recommended that we continue herbania offrequenzia to 60 milligrams, put her on IV flu laser for her pulmonary edema, I also recommended that we put her on IV flu accused seconds for the matter. I also recommended that we put her on IV flu��asemide for her pulmonary edema along with herブرtlency and his T romance of slavery and those background conditions. I also recommended that we put her on IV flu taken on regarding the average of tension medicine for aKimperl語 lab results, Cm as larger as the life expectancy is compared to my average of change between fame add нес which I're doing a holiday for a day during that child, and therefore I don't want to go toooo much older as a anesthetist to deal with American physi터� if that and how there are concerns, along with recommended that we get repeat CMP labs to check the furosemide and consulted radiology and endometrial cardiology to look at a ICD placement along with a PET scan to further evaluate her sarcoidosis. And that's all I have."
" today. Mr. Palmer is a 62-year-old man who presents to the office for the chief complaint of dyspnea with exertion and fatigue. Mr. Palmer is an elementary school teacher with a wife of 30 years. He was in his usual state of excellent health until two weeks ago prior to admission when he developed an acute onset of shortness of breath. He reports walking with his co-workers after work when he felt the symptoms before admission. He describes the symptoms to be generalized throughout his body with a constant duration during exertion. Exercise seems to make it worse. He does not complain of any radiating pain. He rates his pain as a 5 out of 6 on the scale of 0 to 10. Mr. Palmer has a history of high blood pressure, which he was diagnosed with hypertension and is currently being treated for this with lisinopril 10 milligrams. Along with the lisinopril, he does not report any over-the-counter herbal medications. Mr. Palmer does not report any allergies. His social history includes a high blood pressure, which he was diagnosed with hypertension, and is currently a balanced diet, regular exercise before the onset of symptoms two weeks ago, no drug use, no tobacco use, no alcohol use, and regular caffeine consumption of one and a half cups of coffee every morning. He works as an elementary school teacher and is sexually active with his wife. He has a positive surgical history of a cardiac cath performed one year ago at his yearly physical. He has had no hospitalizations. His family history is positive for his family history and his family history is positive for his father passing away at age 59 from an MI and his mother passing away at age 40 from a sudden cardiac death. Today, Mr. Palmer appears awake, alert-oriented, and presents with no fatigue, fever, chills, weight loss, or weight gain. Review of symptoms of his skin was negative with no rash, bruising, lesions, or color changes, or warmth touch. Review of systems of his MSK was negative, no muscle, back, or joint pain. Review of pulmonary systems was positive for wheezing and dyspnea with exertion. Review of cardiovascular systems was positive for palpitations, near syncope, but no passing out, no full syncope, an S4 murmur, and a laterally displaced PMI. His vital signs seemed abnormal with an elevated BP of 130 over 90. Other vital signs were normal with a BPM of 110 and oxygen saturation of 96%. No carotid, bruise, or JVD were noted, no chest wall tenderness, auscultation, and palpation of the epigastric area, was a negative for no bruit or pulsatile mass. Lower extremity pulses were normal bilaterally, lungs were clear to auscultation bilaterally, Hohmann sign was negative, and calves were symmetrical. OMM examination of the thoracic spine was normal with no notable tarch changes. Upon palpation, no lower extremity edema was noted. Review of labs ordered by the family physician three days ago showed cardiomegaly. On chest x-ray, troponin and BNP were within normal limits, and a 2D echo performed showed an asymmetrical left ventricle with an enlarged interventricular septum and an ejection fraction of 60%. Today, Mr. Palmer was diagnosed with familial hypertrophic obstructive cardiomyopathy and is in serious condition. I counseled Mr. Palmer to be admitted to telemetry and to check vitals Q2 hours. He was counseled for activity at the hospital, and he was diagnosed with a and a regular diet. Lecidinib pro 10 mg was discontinued, and disoperamide 100 mg QID was instead started. Referrals to interventional cardiology for AICD placement and cardiothoracic surgery for possible septal myomectomy and alcohol injection were counseled. Thank you."
" Mr. Leslie Palmer, who is a 62-year-old male with a history of hypertension and presented with a chief complaint of shortness of breath and a presyncope episode two weeks ago while walking. The associated episode was with dyspnea that was aggravated while walking and any kind of physical activity, but was relieved with rest. Therefore, he falls under the New York Heart Association classification of two. The patient also described wheezing as well as rasping and fluttering that last for the duration of any kind of exertion. The patient described there was no history of cough, chest pain, no weight loss or fever, chills or sweats. The patient's risk factors for coronary artery disease include a positive family history of an MI on the father's side that passed away at 69 years old and a maternal medical condition. The patient also described a surgical history of sudden cardiac death. Currently, the patient is taking lisinopril for their hypertension and has no known drug allergies. They did have a surgical history of a heart cath. And as for their social history, they have a balanced diet and were very active exercising. But as of now, they have shortness of breath while walking. It's a moderate consumption use of caffeine. And no... consumption of tobacco, alcohol or drugs. They are an elementary... sorry, they are a middle school teacher that lives with their husband. So as for their vital signs, the patient has vitals of blood pressure of 130 over 90, temperature of 98.6, heart rate of 110, respiratory rate of 20, and a saturated blood pressure of 80.2. And as for their social history, they have a balanced diet and were very active exercising. They have a variation of oxygen of 91%. And they appear to wake alert and oriented. I performed a cardiopulmonary physical exam that indicated no carotid bruise and did have a jugular venous distension. They had a regular heart rate, no murmurs, friction, rug, or gallops present, but a laterally displaced PMI. As for respiratory, he had no chest wall tenderness, but wheezes were present with no respiratory problems. They had respiratory distress. In their extremities, their pulses were full and equal with non-tender calves and no pedoedema. I reviewed imaging of a Chex X-ray that indicated cardiomegaly, as well as an echo that indicated left ventricular asymmetry with hypertrophy and an injection fraction of 60%. And their EKG read to be a normal sign for them, with a left ventricular hypertrophy criteria and tall R-wave in the septal leads. Their labs came back showing their troponin and BMP levels was not elevated. Therefore, my assessment for this patient is that they have familial hypertrophic cardiomyopathy, secondary to their hypertension. And this is because of the family history of sudden cardiac death and normal cardiovascular markers. And their labs. That's why I'd like to admit this patient to telemetry for a serious condition and checking their vitals every two hours and indicated activity as tolerated with nursing interventions of daily weights, strict IOs, a nasal cannula oxygen, maintaining their oxygen saturation above 96% and DVT prophylaxis, keeping them on a low sodium diet and IV fluid orders for keeping the veins open. No pain medications, but I would like to add disoperamide, 100 milligrams per oral and discontinue the lisinopril in order to manage any dysrhythmia that they are experiencing. No labs are needed to be ordered as well as non-imaging, but refer and for consult to interventional cardiologists for an AICD placement defibrillator, as well as cardiothoracic surgery consult for a septal myectomy. And I would like to add a few more things. I would like to add a few more things. for the inflammation and management of the hypertrophy. Thank you."
" 62-year-old female named Leslie Palmer. She reported to me today with a history of shortness of breath and fatigue. So the shortness of breath and the fatigue have been progressively worsening over the past six months. And at her visit today, she had reported that the shortness of breath was occurring even at rest. So any sort of physical activity, even just walking down the hall, she reported shortness of breath. And she is having to sleep in a chair for that reason at night. So she did have a positive orthopnea. And again, it is at rest and with physical activity. So additionally, she's been in the past two weeks, she reported that she's gained about eight pounds. And getting into some of her medical history, she does have a history of hypertension, hyperlipidemia. Diabetes and atrial fibrillation. Surgically, she has a history of about 12 years ago, she had a triple bypass surgery. She's also had five stents placed in total. And they did inform her that she's not a candidate for further stents. She was informed by a previous physician that her ejection fraction was about 40%. Getting into some of her medications, she provided me with a list. She was on a good number of medications. To name them, she was on lisinopril, metformin, warfarin, metoprolisuchinate. She was on furosemide. And so that's it for the medications. She did not have any drug allergies. Some of her social history, she has a good balanced diet. She did report that she is actually able to walk daily, even though she did state that she is experiencing shortness of breath. She did report that she is able to walk daily, even though she did state that she is experiencing shortness of breath. With any physical activity, she still was making the effort to walk every day, which is very good. And she does not report any use of illicit medications or over-the-counter medications other than what's prescribed to her. She does have a 30-pack year history, I'm sorry, 30-year history of smoking, for which she has been smoking one pack per day. No alcohol consumption. And she has been drinking about one cup of coffee every day. As far as her sexual activity, she is married, is in a monogamous relationship, and for her living situation, she is living with her husband. So getting into some of her vitals, her blood pressure was significantly low at 80 over 50. Her pulse at about 90, and her oxygen also low at about 86. And her respiration rate was a little bit elevated at 22. And I did discuss that with her and talk about what was standing out in regards to her blood pressure. And I did discuss that with her and talk about what was standing out in regards to her blood pressure. So getting into her physical exam, she did have positive jugular venous distension. However, she did not have any carotid bruit. She did have some swelling in her calves. So she was positive for lower extremity edema. However, her Hohmann's sign was negative. So getting into her lab work. So troponin and BMP, were both elevated. INR was not elevated. Her echo was showing she had a reduced ejection fraction of about 30%. So she had reported in the past that the physician told her it was about 40. And today it was 30. So it possibly could have gone down. Her EKG was showing a left bundle branch block. And so using those findings, I, my diagnosis was a schematology. Um, and then there are more enfin�� relieve pel bear developped. I went to your lab with thevestическая and I was able to tell you that her blood pressure was 20 and not 10, a 40 F . So the they metantly brought down to 30. And the homesickness was no longer. And so my model at stepinc perhaps kind of SAFE says that. for an expert says that her blood pressure was 46 точки, Paralimetry was 49. I between squad versus Muse curve starts to increase her blood pressure, especially her hemical germ höher. So which means that she had your adolescent time to assigned the completamente.中 arbiter Av español constSee how . her blood pressure as it is quite low. It was quite low. But once she returned home her medicated. to to Whitaker, my friends, she thought to me that. because of her lab work and because of her symptoms, I just wanted to make sure that she could be continuously monitored, monitored, taking, taking good care of. So other than that, that would be my encounter. Thank you very much for listening. Bye."
" So, Ms. Leslie is a 62-year-old female presenting with dyspnea, shortness of breath, orthopnea, and a history of progressively worsening symptoms of palpitations and these troubles breathing. This has been going on for the past two months when she went and finally decided to see her family doctor three days ago to address these symptoms. The family doctor sent her away, and then she called the family doctor today, and they told her to go and visit the emergency department. Ms. Leslie has a history of hypertension and pulmonary sarcoidosis. Upon arriving, her vitals were taken, and she had a heart rate of 110, a blood pressure of 136 over 99, and a SpO2 of 9B1. Her familial history is significant for sudden death of her mother at 40 and father dying of a heart attack at 59. She has no known drug allergies. She's currently on the centiparal and prednisone, as well as having no substantial social history other than living with her husband and moderate caffeine usage. Ms. Leslie used to... exercise fairly frequently until the past two months where she's been bedridden. Ms. Leslie sleeps in a chair now because of her orthopnea, so it's easier for her to breathe in a recliner, so that's where she sleeps. And she has an NYHA scale of heart rating of 3, as she has issues with any sort of non-resting activity. Upon that, upon diagnosis... Upon... uh... focused physical exam and diagnostic findings, we determined that Ms. Leslie, we believe she has pulmonary... uh... not pulmonary... sarcoidosis, restrictive cardiomyopathy. We saw that with an x-ray that had... pathognomonic... QR lymph node findings, as well as diffuse infiltrates within the lungs and enlarged heart. And... yes. Ms. Leslie will be... admitted to the hospital in serious condition. She will receive 2 liters of O2 via nasal cannula, as well as increasing her prednisone, keeping her own lisinopril, as well as adding imiodarone and furosemide to relieve edema that she has from a buildup of water in her legs. Or a buildup of fluid in her legs. Furthermore, we consulted radiology for an FDG PET scan, as well as interventional cardiology for a... AICD automatic cardiac defibrillator in her heart. Ms. Leslie was put on a low-salt diet with an IV to keep open, as well as... Leave that mic. During our physical exam, Ms. Leslie did have... abnormal cardiac findings, including a murmur and a gallop at S4. By basilar arousal. And that... is it. So once again, we admitted her to the hospital. And... we started treatment with... furosemide, prednisone, continued lisinopril, and imiodarone to... treat a... paroxysmal ventricular... tachycardia. With that..."
" Hello, Mr. Palmer is a 62-year-old male who presented today with dyspnea and fatigue after being referred to us by his family doctor. He noticed fatigue and dyspnea while walking two weeks ago, although he states that it is better with rest and better with laying down. The dyspnea and fatigue became worse last night, and he also reports a history of presyncope, palpitations, and wheezing. He has a medical history of hypertension, for which he takes lisinopril, and he takes no other medications. He has no allergies. He had a cardiac cath years ago, which came back normal, and he also has a family medical history of sudden death in his mother at 40. His father died of an MI in his 50s. He is an elementary school teacher who drinks one cup of coffee a day, no alcohol, no tobacco, and eats a balanced diet, and he enjoys going for walks every day, although he has been unable to do this recently due to the dyspnea and fatigue. Okay. For his vitals, I noticed a heart rate of 110, oxygen saturation of 96, blood pressure of 130 over 90, and a respiratory rate of 16, and a temperature of 98. On physical exam, I noted a crescendo-decrescendo murmur and a displaced PMI, which I discussed with the patient. For his imaging, on the x-ray, we saw a cardiomyopathy, a cardiomegaly. On the echo, we saw hypertrophy of the septum. And on the EKG, we showed septal hypertrophy with increased amplitude waves in the leads V1, V2, and V3. So the diagnosis, which I think is most likely for his case, is familial hypertrophic cardiomyopathy, which I discussed with the patient, and I prescribed disopiramide for him, discontinued his lisinopril. I also referred him to an intravenous. I also referred him to an intravenous cardiologist, which I discussed with the patient, and a cardiovascular surgeon. Thank you."
" Leslie presents today as a female patient for an evaluation of her shortness of breath, feeling like she's going to pass out, and heart palpitations. She states she can't do anything. She reports this began two months ago and has worsened over the past three days. She was referred here today by her family medicine doctor who saw her three days ago. She notes fatigue and 8-pound weight gain over the past week, lower extremity edema, significant palpitations over the past two months, as well as wheezing and orthopnea over the past two months. Her past medical history includes hypertension and the diagnosis of pulmonary sarcoidosis 25 years ago. She currently takes lisinopril for the hypertension and prednisone for her recent medical issues. The patient currently lives with her husband, who she describes as her social support, and she does have insurance. She currently works as an elementary school teacher. Prior to two months ago, she was an active one. She states due to her symptoms, she is not able to do that now. The patient reports a healthy diet. She reports tachycardia. On the exam today, she had tachycardia at a heart rate of 110 and SpO2 less than 95, hypertension at blood pressure 136 over 99, and a respiratory rate of 20. She was positive for jugular venous distension, negative for carotid brutes, systolic S4 present, gallic present. Negative rubs, rails bilaterally, positive wheezing, plus one pitting edema. She had a bilateral lower extremity pulse and non-tender calves. In summation, with the patient's history of sarcoidosis with positive exam findings, as well as pawnbroker sign and pulmonary edema on anterior-posterior views on radiograph, an echocardiogram displaying restrictive cardiomyopathy with heart failure with preserved heart ejection fraction, normal sinus rhythm with non-sustained ventricular tachycardia, an electrocardiogram, negative troponin, and a brain natripeptide of 4000, she has a diagnosis of sarcoidosis restrictive cardiomyopathy. Today, I stated that she was in New York Heart Association level four, and this is a serious condition. So given these findings and her diagnosis, she will go to the hospital. She will go to telemetry to be continued to be evaluated. And I will consult with an interventional cardiologist as well as a nuclear medicine or radiologist for further workup. She will continue lisinopril 10 milligrams every day. Amyota run 150 milligrams intravenously. Herd in his own will be increased to 60 milligrams every day. And for us, I'm I'd 40 milligrams intravenously repeat vitals will be taken every two hours. And if she decides to get. Get out of bed, she will need assistance. And that is my case presentation for Leslie. Thank you."
