" He's a 62-year-old male presenting for lightheadedness, feeling faint, shortness of breath, feeling raspy, wheezing, and a flutter in his chest. These symptoms come on with activity and have been popping up for the past two weeks with activity onset. He says that it has disrupted majority of his daily activities, and this is the first time this has ever happened to him. He does say symptoms does only get relieved with rest. The patient has a past medical history of hypertension diagnosed 10 years ago. He also had a catheterization one year ago due to an abnormal EKG. The patient denies getting an echo done before in his life. The patient is prescribed lisinopril 10 milligrams that he takes for his hypertension and also reports taking a multivitamin. The patient has no known symptoms. No known drug allergies. No previous surgeries or hospitalizations. Immunizations up to date. Past medical family history is that his mother died at age 40 due to a sudden cardiac death. And father died at age 69 due to an early MI. Patient denies any illicit drug use, tobacco, or alcohol use. Patient. Um, reports that before symptom onset would exercise three to four times a week for 45 to 60 minutes at a time. He is sexually active because, and he is married with one partner and they live together. And he also is a school teacher for seventh grade. Patient is positive for fatigue, palpitations, presyncope, wheezing, dyspnea, and lightheadedness slash dizziness. Upon a vital review, his vitals. Um, showed a heart rate of 110. Blood pressure of 130 over 90 and also O2 stat of 96. His physical exam revealed a jugular venous distention. A laterally displaced PMI, wheezing, and plus one bilateral lower extremity pitting edema. Labs revealed troponin and BNP to be within normal limits. Along with the rest of his blood pressure. The chest X-ray reveals cardiomegaly. An echo revealed an ejection fraction of 60%. Along with left ventricular asymmetry and a thickening of the septum. And the EKG revealed a normal sinus rhythm with left ventricular hypertrophy and tall R waves in the septal leads. So Mr. Palmer was diagnosed with hypertrophic cardiomyopathy with a New York, um, scale of three. Due to his inability to breathe. He was diagnosed with a new York scale of three. Due to his inability to breathe. And he was diagnosed with a new York scale of three. Due to his inability to breathe. And he was also, um, lucky to maintain majority of his, um, normal activities. Patient was admitted to telemetry and activity as tolerated. Nurse intervention orders, um, were strict I's and O's daily weights, DVT, prophylaxis O2, nasal cannula, and to maintain oxygen stats above 96%. He was also ordered, um, a regular diet. And for IV info, and, and, and, and make an deprivation plan. He was also ordered对 belonging to GTO. And he was also ordered to have boyhood with a postdoc exit date and an acute rendezvous. to be KVO. He was discontinued on lisinopril and is now been prescribed disopiramide 100 milligrams per oral. We sent referral to an interventional cardiologist for AICD placement assessment, as well as the cardiothoracic surgeon for assessment for a septal myectomy or alcohol injection. Patient reports having financial stability and insurance to proceed to the hospital for care and has a strong social and emotional support at home. And we reported that upon discharge from the hospital to maintain healthy diet habits, physical activity, and to refrain from strenuous activity until a physician clears and gives the okay. Thank you."
" Patient was a 62-year-old male named Leslie Palmer. Mr. Palmer was coming in for complaints of shortness of breath and fatigue. He said that it started about six months ago but has been increasing. And then over the last three days, that has become significantly worse. He declined any pain and stated that he's been sleeping in his chair, his recliner, and not for relief. He said that he does have symptoms at rest and that nothing has been making it better. So I would say that he's on the NYHA scale as a four symptoms at rest. He has a significant past medical history for hypertension, hyperlipidemia, diabetes, and paroxysmal AFib. His medications include metoprolol, succinate 50 milligrams, lisinopril 10 milligrams, atorvastatin 10 milligrams, metformin 500 milligrams, furosemide 20 milligrams, clopidogrel 75 milligrams, and warfarin 2.5 milligrams. His surgical history includes a CABG 12 years ago, and then he also has had five stents put in over the past five years, with the last one being . . . a year ago. Cardiology told him that he was no longer a candidate for any more. So that was the last one that he had. He has no known drug allergies. Social history is significant for a 30 year history of smoking, one pack per day, and caffeine positive. He's married and denies any alcohol or drugs. He is an elementary school teacher, second grade. Family. Yeah. Yeah. Yeah. Family history, some notable things. His mother died of breast cancer about five years ago at the age of 80. His father is still living, but he is in a memory unit with Alzheimer's disease. On review of systems, some significant findings was that he was very fatigued. He has had a weight gain of around eight pounds over the past two weeks. He did have lower limb edema. He had wheezing. He had dyspnea. And then . . . And then . . . He had a lot of pain. And then . . . He had a lot of pain. He had a lot of pain. And then . . . He had a lot of pain. He was positive for orthopnea. He was positive for orthopnea. On physical exam, his vital signs were as follows. His heart rate was 90. O2 stat on room air was 86%. BP was 80 over 50. Temp was 98.6. And his respirations rate were 22. So we were keeping especially a close eye on the O2 stat and his blood pressure. On the actual physical exam, he did test positive for JVD. No carotid bruises were heard. He was tachycardic with a split S2 on auscultation. His PMI was displaced laterally. He denied any chest tenderness, but he did have the presence of wheezing and bilateral rails on auscultation. Going down his legs, he did have one plus pitting edema, and all peripheral pulses were good and equal. On his lab results, it showed that he did have an elevated troponin of 0.04, and his BMP was very elevated at 4,000. Chest x-ray was significant for cardiomegaly and also showed signs of pulmonary edema. His 2D echo showed that he did have dilated cardiomyopathy with a left ventricular ejection fraction of less than 30, so very reduced. EKG did have a normal sinus rhythm. It looked to me like maybe some AFib on the bottom, which he did say that he was diagnosed with, and a left bundle branch block. There was also on the EKG criteria that met. He was diagnosed with a left ventricular hypertrophy. After I went over this with him and talked to him, I stated that I believed that he had ischemic dilated cardiomyopathy, and that we were going to admit him to the ICU. His condition would be serious. He would be on strict bed rest. Some orders for the nursing staff was to have strict ins and outs, daily weight, and DVT prophylaxis. For his oxygen, we did order a BiPAP 16-6, or FiO2 50%, to try to get his oxygen back up. We're going to keep him on a low-sodium diet. IV fluids, none were indicated at the time, so we're just going to keep him KVO. On the meds, we're actually going to hold on everything except the clopidogrel, 75 milligrams, and his warfarin, 2.5 milligrams. But we are going to add dobutamine. IV drip, and then have him on the insulin sliding scale. Labs, we're going to repeat the troponins and make sure they don't continue to go up, so we're going to do serial troponins. And then we're also going to keep an eye on his PT, PTT, INR, to make sure that his blood isn't getting too thick. And then for consults, I told him that he would be meeting with the interventional cardiologist. They would discuss possibly implanting devices, so the CRTD and the AICD. To help with dysrhythmias and to help his heart do better. So, some lifestyle modifications that I didn't mention with him was, you know, we can promote a healthy diet. We can talk to him about smoking cessation. And I think just maintaining those things would be beneficial. So, yeah, I think that he will do well. We get him in and get him taken care of. Get a couple of maybe devices in to help with his heart. If we keep his AFib under control and maintain his other comorbidities, I think that he will do well. So, thank you."
" This patient is a 62-year-old male who presents to the emergency department with a six-month duration of shortness of breath. He states that for the past three days that his shortness of breath had increased, and as a result, he went to see his primary care physician today. The primary care physician went ahead and sent him over to the ER for that shortness of breath, and he now presents with shortness of breath that is worse with lying down and exacerbated with any form of activity. He states that he has a previous history of diabetes, hypertension, cholesterol, and he previously had a CABG operation 12 years ago, and five years ago, he had a stent placement every year for the last five years. The patient states that his mother died from breast cancer at the age of 80, and his father is currently alive. He has Alzheimer's and is in a current care facility. The patient states that he has gained eight pounds in the last two weeks. He states that he has a wheezing, shortness of breath, fatigue, but he denies any syncope, chest pain, syncope, chest pain. He also states that he has a good diet, relatively healthy, but minimal physical activity due to his symptoms. He also addresses that he is a smoker. He has smoked one pack per day for the last 30 years, and he currently takes Lisinopril 10 times a day. He also takes Metoprol, Succinate 50 mg, Atorvastatin 10 mg, and Metformin 500 BID. He also takes Porosimide 20 mg, as well as Clopidrol 75 mg, Warfarin 2.5 mg, twice a day. While I evaluated him, his labs showed that he had an elevated troponin and BMP, and that his chest x-ray showed cardiomegaly, as well as, bilateral pulmonary infiltrates. He also had an echocardiogram, which shows decreased wall movement, as well as dilated cardiomyopathy. Based on these findings, the physical exam results also showed that he's oriented, fatigued, oriented to time and place, oriented alert to time and place, as well as fatigue. His, pulmonary exam revealed that he has bivasal arreals and wheezing, but no, and a positive gallop, but no rubs, no murmurs. And also his PMI is displaced laterally. On examination, he also had bilateral pitting edema, and he had no neurological findings. His H, he had positive GPD, and his skin findings were negative as well. Based on these results, I went ahead and diagnosed him with dilated, ischemic dilated cardiomyopathy. He, and placed orders to admit him to the ICU. He has an NYHA scale of four. He has, with vitals, Q2 hours, strict fed, and a strict I and O daily weight with DBT prophylaxis. He's been put on a low sodium diet. And he, all of his beds have been held except for clopidogrel, 75 milligrams, warfarin, 2.5 milligrams, BID, dobutamine, IV drip, and an insulin sliding scale. Also gone ahead and put in orders for BiPAP 16 out of six on FIO2, 50% of the time. Diagnostics, I'm going to go ahead and order troponins, PT, INR, and then go ahead and put in a consult with the interventional cardiologist for CRTD and AICD. Please, sir."
" Good morning. My patient today was a 62, I believe, year old male. And he came in complaining of tiredness and shortness of breath. And the first time he had felt these symptoms was about two weeks before, while on a walk with friends and regular exercise and these walks with friends is a normal part of his lifestyle. And so he experienced that shortness of breath and tiredness precipitated by that walking exercise. And it continued to worsen every time he exercised, every time he went on a walk. So he visited his primary care provider, his family medicine doctor. About three days before presenting here at the emergency room. And the family practice doctor ran several tests, ran an EKG. Everything came back negative. So he referred the patient to us at the ER. And as I mentioned, this patient, any activity that's ordinary physical activity, so exercise, exercise resulted in this fatigue and shortness of breath. And when I'm going over his review of symptoms, general beyond the fatigue, excuse me, came back negative as well as the skin, the H E E N T and the musculoskeletal, but in the looking over cardio, in addition to the breathlessness, he also had palpitations and has nearly passed out several times. That has never fully passed out. So. He also experienced psychopathy there are presyncope there, if I may correct myself. And he also experienced wheezing and dyspnea in his pulmonary. When going over his family history the most pertinent information was he had a mother who suddenly died at the age of 40 with no medical explanation ever given and a father who died of a heart attack at the age of 55. He has hypertension and his pastor group. And I think the most important thing for surgical history was the cardiac cath that I believe he might've received at his family practice visit. But no beyond that healthy he's on less than a pro 10 milligrams for that hypertension. So when I went over my physical exam generally I, when listening to his heart and lungs several things came up. Mainly that being the palpitations. There was a murmur present. There was also a displaced point of maximum maximal impulse laterally. And I heard that wheezing when listening to the lungs, but the lower extremity osteopathic everything else about the physical exam came back normal. And when we got his labs back. Everything was negative including troponin and the natural peptide his chest x-ray came back showing no pulmonary edema, but cardio Megali. There's a large increase still at present in his echo came back with left ventricle asymmetric injection fraction of 60%. And in his EKG there was clear tall are waves and the septal leads almost sinus rhythm and it fit the left ventricular. So we are going to talk about the patient's condition and what we have seen in his life so far. And we will start with the patient's condition. So we are going to look at the patient's condition. So this is from the patient's history. So this is from the patient's history. He's been diagnosed with ventricular hypertrophy criteria. So this patient is diagnosed with familial hypertrophic cardiomyopathy and NYHA to classification. And this is secondary to his hypertension. So I admitted him to telemetry. His condition is serious. I ordered vitals to be taken every two hours. He has no known drug allergies, allergies, activity as tolerated for his nursing instructions. So we have a few things. He has no known drug allergies. Allergies activity as tolerated. He has no known blood levels. So this is a direct result of a strict input output. Taking daily weight, DPT prophylaxis, O2 via a nasal cannula, and maintaining oxygen above 96%. He could be put on a regular diet. I also ordered IV fluids via saline lock, and importantly for medications to discontinue his lysine and pill, but initiate disopiramide 100 milligrams, QID. No, I didn't order any disopiramide. in order any diagnostics or imaging, but I did refer him to interventional cardiology for AICD placement. And I also referred him to cardiothoracic surgery for a possible future septal myomectomy or alcohol injection to reduce that left ventricular obstruction. And his vitals, if I forgot to mention, were 110 heart rate, 96% oxygen, 130 over 90 for blood pressure, and 98.6 temperature. Thank you."
" I have a patient, Leslie Palmer, a 62-year-old male that presents the emergency room today complaining of syncopal episodes and shortness of breath happening gradually over the last two weeks. This patient is comfortable at rest. He says that physical activity with his friends, normally around three to five miles, has not been able to happen due to undue breathlessness. He also states that he's been having palpitations and has nearly passed out several other times. He has a hypertension in his past medical history. He's had a cardiac catheterization about a year ago. No evidence of obstructive coronary artery disease. And his past family history, his mother died from a sudden cardiac death, and his dad died from a cardiac myocardial infarction. Social history, he doesn't smoke, doesn't drink. He's an elementary school teacher, has a balanced diet, and he takes lisinopril, 10 milligram, once a day. This patient also presented with no headache or no fever, no chills, no general constitutional symptoms. Main symptoms were cardiovascular. He has palpitations. He has near-syncopal episodes, but no chest pain. Lung-wise, he has no orthopnea, but he does have dyspnea on exertion. He does have wheezing. Patient doesn't have any edema. And on physical exam, we did not notice any lower extremity edema. No jugular vein distention. Pupils were equal. Ground and reactive delight. No issues with his labs. The troponin and the BNP were normal. The Chex-X ray shows cardiomegaly, and we got the echocardiogram as well, and that showed left ventricular hypertrophy and a rejection fraction of the left ventricle, about 60%. EKG confirmed this. He had a normal sinus rhythm at 90 beats per minute. He had a left ventricle hypertrophy voltage criteria, and he had a tall R wave in the septal weeds. He had a left ventricle at 90 beats per minute. Otherwise, this patient was referred to cardiology and to the cardiothoracic surgeon for a potential septal myectomy or alcohol injection, as well as an AICD placement. I started the patient on disopiramide and admitted him to nursing for vitals every two hours. Activity is tolerated and strict ins and outs. He's going to get a daily weight, DVT prophylaxis, and nasal cannula to keep his oxygen above 96%. Diet-wise, we'll keep him on a regular diet, and we'll keep him in the telemetry unit until monitoring is over. Patient has NYHA class 2 familial hypertrophic cardiomyopathy, and he's ready to be seen. Thank you. Bye-bye."
" I just met with a patient who I wanted to present to you about. Mr. Palmer, a 62-year-old man, came into the ED complaining with shortness of breath and fatigue. He reported that he feels tired during exercise but denies any pain. His vitals showed heart rate of 110, oxygen sat of 96%, pulse of 110, respiratory rate of 16, temperature of 98.6 Fahrenheit, and blood pressure of 130 over 90. So this shows that his heart rate is a bit elevated, oxygen is normal, pulse is a little elevated, respiratory is normal, no present fever, and a slightly high blood pressure. As for medical history, he denies any past surgeries but has had a cardiac catheter examination and a previous hospitalization. He reports a medical history of hypertension, for which he takes lisinopril, 10 milligrams, one tap per day. He is up to date on his immunizations. He has no known drug allergies. He reported that his father died of a heart attack many decades ago, and his mother passed away suddenly at the age of 40. Mr. Palmer states that he maintains a balanced diet and exercise routine and denies any illicit drug use, alcohol consumption, or tobacco use. He does have normal caffeine intake, as he is an elementary school teacher. And he is in a monogamous relationship with his wife, with whom he will be supported by today, and they do have insurance. In review of systems, Mr. Palmer reported that he has general fatigue with no pain. He doesn't recall any rash or skin lesions. He denies any neuro discomfort and denies getting dizzy or losing consciousness. He denies any heat issues but does report feeling a flutter in his chest and feeling dyspnea. As for pulmonary, he reports wheezing upon dyspnea. For MSK, he denies any joint aches or pains and doesn't report any edema. Afterwards, I conducted a physical exam. And JVD was negative. No carotid bruise were heard. Cardio exam was positive for regular systolic murmur with PMI displaced laterally. There was negative chest wall tenderness. Lungs were clear to auscultation bilaterally. And there was no peripheral edema and pulses were normal. The calf was not tender. After physical examination and examining past medical history, I came to the diagnosis that Mr. Palmer had hypertrophic cardiomyopathy, or HOCM. The lab vials were normal. The chest x-ray showed cardiomegaly. The echo showed left ventricular asymmetric ejection fraction of 60%. The EKG was normal sinus rhythm with tall R wave subtle leads and left ventricular hyperactivity. The patient was counseled and told his medications would change. I suggested taking him off the lisinopril and administering disapiramide. Mr. Palmer was told that he would be admitted into the hospital telemetry to monitor his cardiac function. And he would be given a consult with interventional cardiology for possible AICD placement and cardiothoracic surgeon for possible myomectomy or alcohol injection. Thank you. Thank you."
" Robin's service, and I saw a patient named Leslie Palmer, which came in today for a chief complaint of fatigue and shortness of breath. Mr. Palmer is a 62-year-old male that comes in complaining of these symptoms beginning about six months ago, progressively getting worse, especially within the last three days. He does not have any chest pain. However, at this point, too, he must sleep in a recliner because he cannot get down or lay down without having shortness of breath symptoms. Overall, this limits his life to about a 10 out of 10. Past surgical history includes triple bypass surgery and five stents being placed. Overall, both surgeries were successful. He does have a support system at home in which he was married to his wife of 30 years. He works as a elementary school teacher. His past medical history includes diabetes mellitus, hypertension, and hyperlipidemia. Overall, he has a good diet. In terms of exercise, he used to go on walks and no longer can due to the symptomology presence. The medications he's on is atorvastatin 10 milligrams, lisinopril 10 milligrams, clopidogrel 75, metformin 500 by daily, grosamide 20 by daily, warfarin 2.5 by daily, and then metoprolol succinate. In terms of review of systems, he said that he did have weight gain of about eight pounds within the last couple of weeks, does complain of fatigue, has lower extremity edema, does have wheezing present, dyspnea, orthopnea, no heart palpitations, though, and no chest pain associated. The patient overall seems like he's awake, alert, oriented, but fatigued again. In terms of vital signs, he's not feeling well, he's not feeling well, he's not feeling well, he's not feeling well, he's not feeling well, he's not feeling well, he's not feeling well, he's not feeling well, his temp was 98.6, heart rate was 90, respiratory rate was 22, blood pressure, he was a bit hypotensive at 80 over 50, and his SpO2 was 86%. Upon physical exam findings, there were no carotid bruise, however, JVD was present. The patient was tachycardic. A murmur that was an S2 split was heard upon physical exam. PMI was displaced laterally, too. There were, basically, basilar raleigh is associated in the lungs. Based on labs that were found, the troponin was high at 0.04, and the BNP was about 4,000, indicating that there was pulmonary edema associated and that the heart tissue was breaking down. Left ventricular and diastolic volume was less than 30%. And also, upon EKG reading, this patient did have a left bundle brain. So, there was a lot of information about the pulmonary edema associated, and the heart tissue was very, very low. Overall, the patient did have a NYHA of a class 4, because any time that he got up from a resting position, he ended up having symptomology. Overall, the plan for this patient is to admit them to the ICU, get vitals every two hours, start being only in bed rest for nursing interventions, daily in and out should be taken, daily weights as well, DVT prophylaxis, and then the IVF. So, this is a very, very important thing to keep in mind. So, if you have a patient with a chronic disease, they should be on a strict low NA plus diet that also corresponds with their diabetes diet as well. They need to keep their vein open, so KBO. In terms of medications, which of all the ones that they were on, they need to stop them, except for the Clopidogrel 75 milligrams and Warfarin 2.5, two times daily, because we do not want to throw a clot. We are also going to add dibutamine. IB drip and an insulin sliding scale do it to his diabetes. Dibutamine will be used to allow for better contraction of the heart, since there was that pulmonary edema. So, in terms of labs that need to be found or keep taken, we need to get serial troponins taken to see if that heart tissue is breaking down more, and also we need to get an INR because of Warfarin. And a constant... So, this was a really good example of how a heart cell for cardiologist was discussed with the patient, and this hopefully will be able to help them either be on a CRTD or an AICD placement. Thank you so much. Bye-bye."
